{
  "id": "ch02-s11",
  "chapter": 2,
  "chapterTitle": "Ethics and Professional Issues",
  "section": 11,
  "sectionTitle": "Standard 9: Assessment",
  "profile": "application-primary",
  "sourceFile": "Ethics.pdf",
  "generatedAt": "2026-09-07",
  "questionTarget": 20,
  "questions": [
    {
      "id": "q01",
      "type": "single",
      "stem": "Dr. Vasquez tells a therapy client that testing will help identify a suitable intervention. She then includes the client's scores in a research study she is running, without asking. Under Standard 9.03 this is:",
      "choices": [
        {
          "id": "a",
          "text": "unethical: the consent covered a different purpose than the one she also pursued"
        },
        {
          "id": "b",
          "text": "acceptable, since the scores were obtained lawfully during treatment"
        },
        {
          "id": "c",
          "text": "acceptable, provided the research report does not identify the client"
        },
        {
          "id": "d",
          "text": "unethical only if the research is later published in a peer-reviewed journal"
        }
      ],
      "answer": [
        "a"
      ],
      "explanation": "Standard 9.03 requires that the consent process cover the nature and purpose of the assessment. Telling a client the results will guide her treatment and then also using them for research without permission is the section's own example of a violation.",
      "whyWrong": {
        "b": "Lawful collection does not extend the consent to a second, undisclosed purpose.",
        "c": "De-identification addresses confidentiality but not the purpose she consented to.",
        "d": "The violation occurs when the data are used beyond the consented purpose, whatever follows."
      },
      "topic": "Informed consent for assessment",
      "level": "application",
      "stemType": "vignette",
      "difficulty": 2,
      "sourceRef": "Section XI.A, Standard 9.03, p. 103"
    },
    {
      "id": "q02",
      "type": "single",
      "stem": "Under Standard 9.03, the informed consent for an assessment must cover the nature and purpose of the assessment, fees, limits on confidentiality, and:",
      "choices": [
        {
          "id": "a",
          "text": "the norms and standardization sample of each instrument"
        },
        {
          "id": "b",
          "text": "the involvement of any third parties"
        },
        {
          "id": "c",
          "text": "the psychologist's own training in the instruments used"
        },
        {
          "id": "d",
          "text": "the length of time the raw data will be retained"
        }
      ],
      "answer": [
        "b"
      ],
      "explanation": "The four items 9.03 names are the nature and purpose of the assessment, fees, any limits on confidentiality, and the involvement of third parties such as a court, parents, or an employer.",
      "whyWrong": {
        "a": "Technical properties of the instruments are not among the required disclosures.",
        "c": "The psychologist's training is not one of the four items listed.",
        "d": "Retention periods belong to record keeping under Standard 6."
      },
      "topic": "Informed consent for assessment",
      "level": "recall",
      "stemType": "short",
      "difficulty": 1,
      "sourceRef": "Section XI.A, Standard 9.03, p. 103"
    },
    {
      "id": "q03",
      "type": "single",
      "stem": "A school administers group achievement testing to every pupil as part of its annual programme. Under Standard 9.03, individual informed consent:",
      "choices": [
        {
          "id": "a",
          "text": "is required from each pupil's parent before testing begins"
        },
        {
          "id": "b",
          "text": "is required unless the school obtains a waiver from the state board"
        },
        {
          "id": "c",
          "text": "is not required, as part of a routine educational activity"
        },
        {
          "id": "d",
          "text": "is not required, since consent never applies to group administration"
        }
      ],
      "answer": [
        "c"
      ],
      "explanation": "Standard 9.03 notes consents for assessment need not be obtained in certain circumstances, including where testing is part of a routine educational, institutional, or organizational activity, or is mandated by law.",
      "whyWrong": {
        "a": "Parental consent is not required for testing that is part of a routine educational activity.",
        "b": "No state-board waiver mechanism appears in the standard.",
        "d": "The exception turns on the routine nature of the activity, not on group administration."
      },
      "topic": "Informed consent for assessment",
      "level": "application",
      "stemType": "vignette",
      "difficulty": 2,
      "sourceRef": "Section XI.A, Standard 9.03, p. 103"
    },
    {
      "id": "q04",
      "type": "single",
      "stem": "A court orders an examinee to undergo a forensic evaluation, and he objects. Under Paragraph 6.03.02 of the Specialty Guidelines for Forensic Psychology, the practitioner:",
      "choices": [
        {
          "id": "a",
          "text": "must obtain the examinee's consent before any examination may proceed"
        },
        {
          "id": "b",
          "text": "must return the matter to the court for a fresh order compelling cooperation"
        },
        {
          "id": "c",
          "text": "may proceed only after the examinee has consulted his own attorney"
        },
        {
          "id": "d",
          "text": "can conduct the examination over the objection and without the examinee's consent"
        }
      ],
      "answer": [
        "d"
      ],
      "explanation": "The Guidelines state that where an examinee is ordered by the court to participate, the forensic practitioner can conduct the examination over the objection and without the consent of the examinee.",
      "whyWrong": {
        "a": "A court order displaces the ordinary consent requirement for the examination.",
        "b": "A fresh order is not required; the existing one suffices.",
        "c": "Advising the examinee to contact an attorney is one option where he declines, not a precondition to proceeding."
      },
      "topic": "Informed consent for assessment",
      "level": "application",
      "stemType": "vignette",
      "difficulty": 3,
      "sourceRef": "Section XI.A, p. 103"
    },
    {
      "id": "q05",
      "type": "single",
      "stem": "Standard 9.04 defines test data as raw and scaled scores, the client's responses to test questions or stimuli, and:",
      "choices": [
        {
          "id": "a",
          "text": "the psychologist's notes and recordings of statements and behavior"
        },
        {
          "id": "b",
          "text": "the manuals and protocols used to administer and score the instrument"
        },
        {
          "id": "c",
          "text": "the normative tables against which the client's scores were compared"
        },
        {
          "id": "d",
          "text": "the referral question and any correspondence with the referring party"
        }
      ],
      "answer": [
        "a"
      ],
      "explanation": "Test data are raw and scaled scores, client responses to test questions or stimuli, and psychologists' notes and recordings concerning client statements and behavior during an examination.",
      "whyWrong": {
        "b": "Manuals and protocols are test materials under 9.11, a separate category.",
        "c": "Normative tables form part of the instrument rather than the client's data.",
        "d": "Referral correspondence is not part of the definition."
      },
      "topic": "Test data and test materials",
      "level": "recall",
      "stemType": "short",
      "difficulty": 2,
      "sourceRef": "Section XI.B, Standard 9.04, p. 103"
    },
    {
      "id": "q06",
      "type": "single",
      "stem": "A client asks Dr. Iqbal for the protocols, manuals, and item booklets from her recent testing so she can review them at home. These fall under:",
      "choices": [
        {
          "id": "a",
          "text": "Standard 9.04 on test data, which are ordinarily provided to the client"
        },
        {
          "id": "b",
          "text": "Standard 9.11 on test materials, whose integrity and security must be protected"
        },
        {
          "id": "c",
          "text": "Standard 6.01, which governs the maintenance of client records generally"
        },
        {
          "id": "d",
          "text": "HIPAA's designated record set, which the client may inspect and copy"
        }
      ],
      "answer": [
        "b"
      ],
      "explanation": "Standard 9.11 defines test materials as manuals, instruments, protocols, and test questions or stimuli, and requires reasonable efforts to protect their integrity and security. That is distinct from test data, which are ordinarily provided.",
      "whyWrong": {
        "a": "Test data are the client's scores, responses, and the psychologist's notes — not the instruments themselves.",
        "c": "6.01 concerns record maintenance rather than the security of test instruments.",
        "d": "Test materials are not part of the designated record set the client may obtain."
      },
      "topic": "Test data and test materials",
      "level": "application",
      "stemType": "vignette",
      "difficulty": 2,
      "sourceRef": "Section XI.B, Standards 9.04 and 9.11, p. 103"
    },
    {
      "id": "q07",
      "type": "single",
      "stem": "Dr. Marchetti allows a client to take the MMPI home to complete at her convenience. This is problematic because it:",
      "choices": [
        {
          "id": "a",
          "text": "breaches the client's confidentiality under Standard 4.01"
        },
        {
          "id": "b",